abstract,keyword,country
"Many mechanisms have been proposed to alleviate the magnetic catastrophe, which prevents the Keplerian disk from forming inside a collapsing magnetized core. Such propositions include inclined field and non-ideal magnetohydrodynamics effects, and have been supported with numerical experiments. Models have been formulated for typical disk sizes when a field threads the rotating disk, parallel to the rotation axis, while observations at the core scales do not seem to show evident correlation between the directions of angular momentum and the magnetic field. In the present study, we propose a new model that considers both vertical and horizontal fields and discuss their effects on the protoplanetary disk size.",['diffusion – gravitation – magnetohydrodynamics (MHD) – protoplanetary disks'],"['Taiwan', 'Taiwan', 'Taiwan', 'India', 'Taiwan', 'France', 'France', 'France', 'France']"
"Knowing who follows whom and what patterns they are following are crucial steps to understand collective behaviors (e.g. a group of human, a school of fish, or a stock market). Time series is one of resources that can be used to get insight regarding following relations. However, the concept of following patterns or motifs and the solution to find them in time series are not obvious. In this work, we formalize a concept of following motifs between two time series and present a framework to infer following patterns between two time series. The framework utilizes one of efficient and scalable methods to retrieve motifs from time series called the Matrix Profile Method. We compare our proposed framework with several baselines. The framework performs better than baselines in the simulation datasets. In the dataset of sound recording, the framework is able to retrieve the following motifs within a pair of time series that two singers sing following each other. In the cryptocurrency dataset, the framework is capable of capturing the following motifs within a pair of time series from two digital currencies, which implies that the values of one currency follow the values of another currency patterns. Our framework can be utilized in any field of time series to get insight regarding following patterns between time series.","['time series, following relations, matrix profile, data science']","['1212BangkokThailand43017-6221', 'PathumthaniThailand']"
"The isolated globule B335 contains a single,
low luminosity Class 0 protostar associated with a bipolar nebula
and outflow system seen nearly perpendicular to its axis.
We observed the innermost regions of this outflow
as part of JWST/NIRCam GTO program 1187,
primarily intended for wide-field slitless spectroscopy of background stars behind the globule.
We find a system of expanding shock fronts with kinematic ages of only a few decades emerging
symmetrically
from the position of the embedded protostar, which is not directly
detected at NIRCam wavelengths.
The innermost and youngest of the shock fronts studied here shows strong emission from CO.
The next older shock front shows less CO and the third shock front shows only H22{}_{2}start_FLOATSUBSCRIPT 2 end_FLOATSUBSCRIPT emission in our data.
This third and most distant of these inner shock fronts shows substantial
evolution of its shape since it was last observed with high spatial resolution in 1996 with Keck/NIRC.
This may be evidence of a faster internal shock catching up with a slower one and of the two shocks merging.","['Young stellar objects (1834) —', 'Protostars (1302) —', 'Cometary globules (276) —', 'Stellar jets (1607) —']","['USA', '91125', 'USA', 'USA', 'Canada', 'Canada', 'USA', 'USA', 'USA', '91125', 'USA', 'USA', 'USA', '20024']"
"In modern pathology, multiplexed immunofluorescence (mIF) and multiplex immunohistochemistry (mIHC) bring both vast opportunities and challenges. These techniques illuminate complex tumor microenvironment interactions, necessitating intuitive visualization tools. With the rise of electronic health records (EHR) and information overload for physicians, integrating advanced technologies becomes essential. Enter SpatialVisVR: a versatile VR platform for comparing medical images, adaptable for data privacy on embedded hardware. Clinicians can capture pathology slides in real-time via mobile, then SpatialVisVR employs a deep learning algorithm to match and display similar mIF images. This interface allows for adding or removing up to 100 multiplexed protein channels, aiding immuno-oncology decisions. Ultimately, SpatialVisVR aims to refine diagnostic processes, promoting a holistic, efficient approach to immuno-oncology research and treatment.","['Virtual', 'Reality,', 'Augmented', 'Reality,', 'Mixed', 'Reality,', 'H&E,', 'CODEX,', 'Digital', 'Pathology,', 'Edge', 'Detection,', 'Search']","['ArlingtonArlingtonTexasUSA76010', 'ArlingtonArlingtonTexasUSA', 'ArlingtonArlingtonTexasUSA', 'ArlingtonArlingtonTexasUSA', 'ArlingtonArlingtonTexasUSA', 'ArlingtonArlingtonTexasUSA', 'ArlingtonArlingtonTexasUSA', 'ArlingtonArlingtonTexasUSA', 'ArlingtonArlingtonTexasUSA', 'AngelesCaliforniaUSA', 'ArlingtonArlingtonTexasUSA']"
"We report dynamical mass measurements of the individual stars in the most luminous and massive stellar member of the nearby Ophiuchus star-forming region, the young tight binary system S1. We combine 28 archival datasets with seven recent, proprietary VLBA observations obtained as part of the Dynamical Masses of Young Stellar Multiple Systems with the VLBA project (DYNAMO–VLBA), to constrain the astrometric and orbital parameters of the system, and recover high accuracy dynamical masses. The primary component, S1A, is found to have a mass of 4.11±plus-or-minus\pm±0.10 M⊙direct-product{}_{\odot}start_FLOATSUBSCRIPT ⊙ end_FLOATSUBSCRIPT, significantly less than the typical value, ∼similar-to\sim∼ 6 M⊙direct-product{}_{\odot}start_FLOATSUBSCRIPT ⊙ end_FLOATSUBSCRIPT previously reported in the literature. We show that the spectral energy distribution of S1A can be reproduced by a reddened blackbody with a temperature between roughly 14,000 K and 17,000 K. According to evolutionary models, this temperature range corresponds to stellar masses between 4 M⊙direct-product{}_{\odot}start_FLOATSUBSCRIPT ⊙ end_FLOATSUBSCRIPT and 6 M⊙direct-product{}_{\odot}start_FLOATSUBSCRIPT ⊙ end_FLOATSUBSCRIPT so the SED is not a priori inconsistent with the dynamical mass of S1A. The luminosity of S1 derived from SED-fitting, however, is only consistent with models for stellar masses above 5 M⊙direct-product{}_{\odot}start_FLOATSUBSCRIPT ⊙ end_FLOATSUBSCRIPT. Thus, we cannot reconcile the evolutionary models with the dynamical mass measurement of S1A: the models consistent with the location of S1A in the HR diagram correspond to masses at least 25% higher than the dynamical mass. For the secondary component, S1B, a mass of 0.831 ±plus-or-minus\pm± 0.014 M⊙direct-product{}_{\odot}start_FLOATSUBSCRIPT ⊙ end_FLOATSUBSCRIPT is determined, consistent with a low-mass young star. While the radio flux of S1A remains roughly constant throughout the orbit, the flux of S1B is found to be higher near the apastron.",['astrometry — stars:formation — stars:kinematics'],"['México', 'México', 'Germany', 'France', 'México', 'México', 'Germany', 'USA', 'México', 'Germany', 'Brazil', 'UK', 'México', 'USA']"
"As the decarbonization of power systems accelerates, there has been increasing interest in capacity expansion models for their role in guiding this transition. Representative period selection is an important component of capacity expansion modeling, enabling computational tractability of optimization while ensuring fidelity between the representative periods and the full year. However, little attention has been devoted to selecting representative periods longer than a single day. This prevents the capacity expansion model from directly simulating interday energy sharing, which is of key importance as energy generation becomes more variable and storage more important. To this end, we propose a novel method for selecting representative periods of any length. The method is validated using a capacity expansion model and production cost model based on California’s decarbonization goals. We demonstrate that the representative period length has a substantial impact in the results of the capacity expansion investment plan.","['Index', 'Terms: ', 'Capacity expansion planning, representative period selection, production cost modeling.']","['CA', 'WA']"
"This paper presents a two stage approach for the processing of frequency-stacked mobile sub-bands. The frequency stacking is performed in the analogue domain to enable the use of a wideband ADC, instead of employing multiple narrowband ADCs, to support multiple antenna elements for digital satellite beamforming. This analogue front end provides a common broadband digital interface to the on-board processor and can be configured to support multiple satellite missions, reducing the cost of commissioning a digital processor for individual satellite missions. This paper proposes a framework on the specification of digital prototype filter for the Analysis of frequency-stacked mobile sub-bands. The computational complexity of the Analysis operation, with two digital filter alternatives, are evaluated. A series of results, taken from our European Space Agency sponsored project, are presented here to demonstrate the applicability of the proposed two stage approach, reporting on the savings in power consumption when an Nth-band all-pass based recursive filter having an Infinite Impulse Response is used as the digital prototype filter.","['Index', 'Terms: ', 'Satellite', 'Communication', 'Systems,', 'Digital', 'Signal', 'Processing,', 'Discrete', 'Fourier', 'Transform,', 'Digital', 'Filter', 'Bank,', 'Analog to', 'Digital', 'Convertor.']","['christoph.ernst}@esa.int', 'robert.ro.hughes}@airbus.com', 'kalei@westminster.ac.uk']"
"Supporting the interactive exploration of large datasets is a popular and challenging use case for data management systems.
Traditionally, the interface and the back-end system are built and optimized separately, and interface design and system optimization require different skill sets that are difficult for one person to master.
To enable analysts to focus on visualization design, we contribute VegaPlus, a system that automatically optimizes interactive dashboards to support large datasets.
To achieve this, VegaPlus leverages two core ideas. First, we introduce an optimizer that can reason about execution plans in Vega, a back-end DBMS, or a mix of both environments. The optimizer also considers how user interactions may alter execution plan performance, and can partially or fully rewrite the plans when needed.
Through a series of benchmark experiments on seven different dashboard designs, our results show that VegaPlus provides superior performance and versatility compared to standard dashboard optimization techniques.","['data analytics, scalable visualization']","['WashingtonSeattleUSA', 'UniversityPittsburghUSA', 'ParkUSA', 'UniversityPittsburghUSA', 'WashingtonSeattleUSA']"
"Semantic embeddings play a crucial role in natural language-based information retrieval.
Embedding models represent words and contexts as vectors whose spatial configuration is derived from the distribution of words in large text corpora.
While such representations are generally very powerful, they might fail to account for fine-grained domain-specific nuances.
In this article, we investigate this uncertainty for the domain of characterizations of expressive piano performance.
Using a music research dataset of free text performance characterizations and a follow-up study sorting the annotations into clusters, we derive a ground truth for a domain-specific semantic similarity structure.
We test five embedding models and their similarity structure for correspondence with the ground truth.
We further assess the effects of contextualizing prompts, hubness reduction, cross-modal similarity, and k-means clustering.
The quality of embedding models shows great variability with respect to this task; more general models perform better than domain-adapted ones and the best model configurations reach human-level agreement.","['Semantic', 'Similarity,', 'Embeddings,', 'Evaluation,', 'Music', 'Performance']","['UniversityLinzAustria', 'UniversityLinzAustria', 'UniversityLinzAustria', 'UniversityLinzAustria']"
"Large Language Models (LLMs) have gained considerable notoriety in the field of natural language to SQL tasks (NL2SQL). In this study, we show how task decomposition can greatly benefit LLMs in database understanding and query generation in order to answer human questions with an SQL query.
We fined-tuned open source models, specifically Llama-2 and Code Llama, by combining 2 different models each designated to focus on one of two tasks in order to leverage each model’s core competency to further increase the accuracy of the final SQL query.
We propose a new framework to divide the schema into chunks in order to fit more information into a limited context. Our results are comparable with those obtained by GPT-4 at the same time being ~135 times smaller, 90 times faster and more than 100 times cheaper than GPT-4.","['NL2SQL,', 'LLM,', 'AI,', 'Prompt', 'Decomposition']","['SpaSantiagoChile', 'SpaSantiagoChile', 'SpaSantiagoChile']"
"The clustering coefficient is a valuable tool for understanding the structure of complex networks. It is widely used to analyze social networks, biological networks, and other complex systems. While there is generally a single common definition for the local clustering coefficient, there are two different ways to calculate the global clustering coefficient. The first approach takes the average of the local clustering coefficients for each node in the network. The second one is based on the ratio of closed triplets to all triplets. It is shown that these two definitions of the global clustering coefficients are strongly inequivalent and may significantly impact the accuracy of the outcome.",['complex networks; statistical mechanics; graph ensembles; clustering coefficient; hidden variables; graph temperature'],['México']
"Lifshitz transitions are topological transitions of a Fermi surface, whose signatures typically appear in the conduction properties of a host metal. Here, we demonstrate, using an extended Falicov-Kimball model of a two-flavor fermion system, that a Lifshitz transition which occurs in the non-interacting limit impacts interaction-induced insulating phases, even though they do not host Fermi surfaces.
For strong interactions we find a first order transition between states of different polarization
This transition line ends in a very unusual quantum critical endpoint, whose presence is stabilized by the onset of inter-flavor coherence. We demonstrate that the surfaces of maximum coherence in these states reflect the distinct Fermi surface topologies of the states separated by the non-interacting Lifshitz transition.
The phenomenon is shown to be independent of the band topologies involved. Experimental realizations of our results are discussed for both electronic and optical lattice systems.","['first keyword, second keyword, third keyword']","['USA', 'USA', 'USA', 'USA']"
"In this paper, we investigate the quantum entanglement induced by phase-space noncommutativity. Both the position-position and momentum-momentum noncommutativity are incorporated to study the entanglement properties of coordinate and momentum degrees of freedom under the shade of oscillators in noncommutative space. Exact solutions for the systems are obtained after the model is re-expressed in terms of canonical variables, by performing a particular Bopp’s shift to the noncommuting degrees of freedom.
It is shown that the bipartite Gaussian state for an isotropic oscillator is always separable. To extend our study for the time-dependent system, we allow arbitrary time dependency on parameters. The time-dependent isotropic oscillator is solved with the Lewis-Riesenfeld invariant method. It turns out that even for arbitrary time-dependent scenarios, the separability property does not alter.

We extend our study to the anisotropic oscillator, which provides an entangled state even for time-independent parameters. The Wigner quasi-probability distribution is constructed for a bipartite Gaussian state. The noise matrix (covariance matrix) is explicitly studied with the help of Wigner distribution. Simon’s separability criterion (generalized Peres-Horodecki criterion) has been employed to find the unique function of the (mass and frequency) parameters, for which the bipartite states are separable. In particular, we show that the mere inclusion of non-commutativity of phase-space is not sufficient to generate the entanglement, rather anisotropy is important at the same footing.","['Noncommutative space;', 'Peres-Horodecki separability criterion;', 'Wigner distribution;', 'Time-dependent system;', 'Anisotropic oscillator']","['700131.', '700131.', 'India-700108']"
"PDS 70 hosts two massive, still-accreting planets and the inclined orientation of its protoplanetary disk presents a unique opportunity to directly probe the vertical gas structure of a planet-hosting disk. Here, we use high-spatial-resolution (≈0⁢.′′⁢1absent0arcsecond1{\approx}0\farcs 1≈ 0 start_ID start_POSTFIX SUPERSCRIPTOP . ′ ′ end_POSTFIX end_ID 1;10 au) observations in a set of CO isotopologue lines and HCO+{}^{+}start_FLOATSUPERSCRIPT + end_FLOATSUPERSCRIPT J=4–3 to map the full 2D (r,z)𝑟𝑧(r,z)( italic_r , italic_z ) disk structure from the disk atmosphere, as traced by 1212{}^{12}start_FLOATSUPERSCRIPT 12 end_FLOATSUPERSCRIPTCO, to closer to the midplane, as probed by less abundant isotopologues and HCO+{}^{+}start_FLOATSUPERSCRIPT + end_FLOATSUPERSCRIPT. In the PDS 70 disk, 1212{}^{12}start_FLOATSUPERSCRIPT 12 end_FLOATSUPERSCRIPTCO traces a height of z/r≈0.3𝑧𝑟0.3z/r\approx 0.3italic_z / italic_r ≈ 0.3, 1313{}^{13}start_FLOATSUPERSCRIPT 13 end_FLOATSUPERSCRIPTCO is found at z/r≈0.1𝑧𝑟0.1z/r\approx 0.1italic_z / italic_r ≈ 0.1, and C1818{}^{18}start_FLOATSUPERSCRIPT 18 end_FLOATSUPERSCRIPTO originates at, or near, the midplane. The HCO+{}^{+}start_FLOATSUPERSCRIPT + end_FLOATSUPERSCRIPT surface arises from z/r≈0.2𝑧𝑟0.2z/r\approx 0.2italic_z / italic_r ≈ 0.2 and is one of the few non-CO emission surfaces constrained with high fidelity in disks to date. In the 1212{}^{12}start_FLOATSUPERSCRIPT 12 end_FLOATSUPERSCRIPTCO J=3–2 line, we resolve a vertical dip and steep rise in height at the cavity wall, making PDS 70 the first transition disk where this effect is directly seen in line emitting heights. In the outer disk, the CO emission heights of PDS 70 appear typical for its stellar mass and disk size and are not substantially altered by the two inner embedded planets. By combining CO isotopologue and HCO+{}^{+}start_FLOATSUPERSCRIPT + end_FLOATSUPERSCRIPT lines, we derive the 2D gas temperature structure and estimate a midplane CO snowline of ≈{\approx}≈56-85 au. This implies that both PDS 70b and 70c are located interior to the CO snowline and are likely accreting gas with a high C/O ratio of ≈{\approx}≈1.0, which provides context for future planetary atmospheric measurements from, e.g., JWST, and for properly modeling their formation histories.","['Protoplanetary disks (1300) —', 'Planet formation (1241) —', 'CO line emission (262) —', 'High angular resolution (2167)']","['Fellow', 'USA', 'USA', 'France', 'France', 'Italy', 'USA', 'USA', 'USA', 'Netherlands', 'USA', 'Netherlands', 'Italy']"
"Multi-wavelength spectroscopy of NGC 5548 revealed remarkable changes due to presence of an obscuring wind from the accretion disk. This broadened our understanding of obscuration and outflows in AGN. Swift monitoring of NGC 5548 shows that over the last 10 years the obscuration has gradually declined. This provides a valuable opportunity for analyses that have not been feasible before because of too much obscuration. The lowered obscuration, together with the high energy spectral coverage of Chandra HETG, facilitate the first study of X-ray absorption lines in the obscured state. The comparison of the lines (Mg xi, Mg xii, Si xiii, and Si xiv) between the new and historical spectra reveals interesting changes, most notably the He-like absorption being significantly diminished in 2022. Our study finds that the changes are caused by an increase in both the ionization parameter and the column density of the warm-absorber outflow in the obscured state. This is contrary to the shielding scenario that is evident in the appearance of the UV lines, where the inner obscuring wind shields outflows that are located further out, thus lowering their ionization. The X-ray absorption lines in the HETG spectra appear to be unaffected by the obscuration. The results suggest that the shielding is complex since various components of the ionized outflow are impacted differently. We explore various possibilities for the variability behavior of the X-ray absorption lines and find that the orbital motion of a clumpy ionized outflow traversing our line of sight is the most likely explanation.","['accretion disks – galaxies: active – galaxies: individual (NGC 5548) — quasars: absorption lines — techniques: spectroscopic —', 'X-rays: galaxies']","['mmehdipour@stsci.edu', 'mmehdipour@stsci.edu', 'Netherlands', 'Netherlands', 'Netherlands', 'Netherlands', 'Netherlands', 'Japan', 'Netherlands', 'UK', 'China', 'Netherlands', 'USA', 'USA']"
"With the rise of human-machine communication, machines are increasingly designed with humanlike characteristics, such as gender, which can inadvertently trigger cognitive biases. Many conversational agents (CAs), such as voice assistants and chatbots, are predominantly designed with female personas. This leads to concerns about perpetuating gender stereotypes and inequality. Critiques have emerged regarding the potential objectification of females and the reinforcement of gender stereotypes by these technologies. This research, situated in conversational AI design, aims to delve deeper into the impacts of gender biases in human-CA interactions. From a behavioral and communication research standpoint, this program focuses not only on perceptions but also the linguistic styles of users when interacting with CAs, as previous research has rarely explored. It aims to understand how pre-existing gender biases might be triggered by CAs’ gender designs. It further investigates how CAs’ gender designs may reinforce gender biases and extend them to human-human communication. The findings aim to inform the ethical design of conversational agents, addressing whether gender assignment in CAs is appropriate and how to promote gender equality in design.","['conversational agent, cognitive biases, gender,', 'UX research']",['4116ChampaignILUSA61820']
"We report multi-epoch astrometric VLBI observations of the chromospherically active binary HR 1099 (V711 Tau, HD 22468) at six epochs over 63 days using the Very Long Baseline Array at 22.2 GHz. We determined hourly radio centroid positions at each epoch with a positional uncertainty significantly smaller than the component separation. The aggregate radio positions at all epochs define an ellipse in the co-moving reference frame with an inclination i=39.5⁢°⁢−3.5⁢°+3.6⁢°𝑖39.5°subscriptsuperscriptabsent3.6°3.5°i={39.5\arcdeg}{\raisebox{2.15277pt}{\tiny${}^{+3.6\arcdeg}_{-3.5\arcdeg}$}}italic_i = 39.5 ° start_FLOATSUPERSCRIPT + 3.6 ° end_FLOATSUPERSCRIPT start_POSTSUBSCRIPT - 3.5 ° end_POSTSUBSCRIPT and longitude of ascending node Ω=212⁢°±22⁢°Ωplus-or-minus212°22°\Omega=212\arcdeg\pm 22\arcdegroman_Ω = 212 ° ± 22 °. The ellipse center is offset from the Third Gaia Celestial Reference Frame position by Δ⁢αΔ𝛼\Delta\alpharoman_Δ italic_α = −0.81⁢−0.37+0.250.81subscriptsuperscriptabsent0.250.37{-0.81}{\raisebox{2.15277pt}{\tiny${}^{+0.25}_{-0.37}$}}- 0.81 start_FLOATSUPERSCRIPT + 0.25 end_FLOATSUPERSCRIPT start_POSTSUBSCRIPT - 0.37 end_POSTSUBSCRIPT mas, Δ⁢δΔ𝛿\Delta\deltaroman_Δ italic_δ = 0.45⁢−0.25+0.230.45subscriptsuperscriptabsent0.230.25{0.45}{\raisebox{2.15277pt}{\tiny${}^{+0.23}_{-0.25}$}}0.45 start_FLOATSUPERSCRIPT + 0.23 end_FLOATSUPERSCRIPT start_POSTSUBSCRIPT - 0.25 end_POSTSUBSCRIPT mas. All radio centroids are well-displaced from the binary center of mass at all epochs, ruling out emission from the inter-binary region. We examined the motion of the radio centroids within each epoch by comparing hourly positions over several hours. The measured speeds were not statistically significant for five of the six epochs, with 2⁢σ2𝜎2\sigma2 italic_σ upper limits in the range 200–1000 km sec−11{}^{-1}start_FLOATSUPERSCRIPT - 1 end_FLOATSUPERSCRIPT. However, for one flaring epoch, there was a ∼3⁢σsimilar-toabsent3𝜎\sim 3\sigma∼ 3 italic_σ detection v⟂=228±85subscript𝑣perpendicular-toplus-or-minus22885v_{\perp}=228\pm 85italic_v start_POSTSUBSCRIPT ⟂ end_POSTSUBSCRIPT = 228 ± 85 km sec−11{}^{-1}start_FLOATSUPERSCRIPT - 1 end_FLOATSUPERSCRIPT. This speed is comparable to the mean speed of observed coronal mass ejections on the Sun.","['Stellar coronae (305) —', 'Interferometric binary stars (806) —', 'Magnetic stars (995) —', 'Plasma astrophysics (1261) —', 'Radio astrometry (1337) —', 'Radio continuum emission (1340) —', 'RS', 'Canum', 'Venaticorum variable stars (1416) —', 'Spectroscopic binary stars (1557) —', 'Starlight polarization (1571) —', 'Starspots (1572) —', 'Stellar magnetic fields (1610)']","['USA', 'USA', 'USA', 'USA']"
