abstract,keyword,country
"This study investigates the integration of assistive therapeutic robotics, wearable sensors, and spatial sensors within an intelligent environment tailored for dementia care. The feasibility study aims to assess the collective impact of these technologies in enhancing care giving by seamlessly integrating supportive technology in the background. The wearable sensors track physiological data, while spatial sensors monitor geo-spatial information, integrated into a system supporting residents without necessitating technical expertise. The designed space fosters various activities, including robot interactions, medication delivery, physical exercises like walking on a treadmill (Bruce protocol), entertainment, and household tasks, promoting cognitive stimulation through puzzles. Physiological data revealed significant participant engagement during robot interactions, indicating the potential effectiveness of robot-assisted activities in enhancing the quality of life for residents.","['Index', 'Terms: ', 'Humanoid', 'Robot,', 'Pepper robot, dementia friendly living space,', 'Alzheimer’s care giving,', 'Electrodermal activity,', 'EDA;', 'Physiological data;']","['0000-0001-8779-9617', 'rjd6099@psu.edu', 'mart5877@d.umn.edu', 'dowli026@d.umn.edu', 'rana.z.imtiaz@gmail.com']"
"The recognition of human activities based on WiFi Channel State Information (CSI) enables contactless and visual privacy-preserving sensing in indoor environments. However, poor model generalization, due to varying environmental conditions and sensing hardware, is a well-known problem in this space. To address this issue, in this work, data augmentation techniques commonly used in image-based learning are applied to WiFi CSI to investigate their effects on model generalization performance in cross-scenario and cross-system settings. In particular, we focus on the generalization between line-of-sight (LOS) and non-line-of-sight (NLOS) through-wall scenarios, as well as on the generalization between different antenna systems, which remains under-explored. We collect and make publicly available a dataset of CSI amplitude spectrograms of human activities. Utilizing this data, an ablation study is conducted in which activity recognition models based on the EfficientNetV2 architecture are trained, allowing us to assess the effects of each augmentation on model generalization performance. The gathered results show that specific combinations of simple data augmentation techniques applied to CSI amplitude data can significantly improve cross-scenario and cross-system generalization.","['Index', 'Terms: ', 'Data', 'Augmentation,', 'Model', 'Generalization,', 'Human', 'Activity', 'Recognition,', 'WiFi,', 'Channel', 'State', 'Information']",['martin.kampel}@tuwien.ac.at']
"More than one hundred tidal disruption events (TDEs) have been detected at multi-bands, which can be viewed as extreme laboratories to investigate the accretion physics and gravity in the immediate vicinity of massive black holes (MBHs). Future transient surveys are expected to detect several tens of thousands of TDEs, among which a small fraction may be strongly gravitationally lensed by intervening galaxies. In this paper, we statistically etsimate the detection rate of lensed TDEs, with dependence on the limiting magnitude of the transient all-sky surveys searching for them. We find that the requisite limiting magnitude for an all-sky transient survey to observe at least 1111 yr−11{}^{-1}start_FLOATSUPERSCRIPT - 1 end_FLOATSUPERSCRIPT is ≳21.3greater-than-or-equivalent-toabsent21.3\gtrsim 21.3≳ 21.3, 21.221.221.221.2, and 21.521.521.521.5 mag in the u-, g-, and z-bands, respectively. If the limiting magnitude of the all-sky survey can reach ∼25−26similar-toabsent2526\sim 25-26∼ 25 - 26 mag in the u-, g-, and z-bands, the detection rate can be upto about several tens to hundreds per year. The discovery and identification of the first image of the lensed TDE can be taken as an early-warning of the second and other subsequent images, which may enable detailed monitoring of the pre-peak photometry and spectroscopy evolution of the TDE. The additional early-stage information may help to constrain the dynamical and radiation processes involving in the TDEs.","['Accretion (14);', 'Gravitational lensing (670);', 'Supermassive black holes (1663);', 'Tidal disruption (1696);', 'Time domain astronomy(2019);', 'Transient sources (1851)']","['China;', 'China', 'China;', 'China', 'China', 'China;']"
"Programming problems can be solved in a multitude of functionally correct ways, but the quality of these solutions (e.g. readability, maintainability) can vary immensely.
When code quality is poor, symptoms emerge in the form of ‘code smells’, which are specific negative characteristics (e.g. duplicate code) that can be resolved by applying refactoring patterns.
Many undergraduate computing curricula train students on this software engineering practice, often doing so via exercises on unfamiliar instructor-provided code.
Our observation, however, is that this makes it harder for novices to internalise refactoring as part of their own development practices.
In this paper, we propose a new approach to teaching refactoring, in which students must first complete a programming exercise constrained to ensure they will produce a code smell.
This simple intervention is based on the idea that learning refactoring is easier if students are familiar with the code (having built it), that it brings refactoring closer to their regular development practice, and that it presents a powerful opportunity to learn from a ‘mistake’.
We designed and conducted a study with 35 novice undergraduates in which they completed various refactoring exercises alternately taught using a traditional and our ‘mistake-based’ approach, finding that students were significantly more effective and confident at completing exercises using the latter.","['Refactoring, code smells, code quality, software maintenance, software engineering, mistake-based learning, undergraduate course']","['UniversitySingapore', 'UniversitySingapore']"
"Suicide is recognized as one of the most serious concerns in the modern society. Suicide causes tragedy that affects countries, communities, and families. There are many factors that lead to suicidal ideations. Early detection of suicidal ideations can help to prevent suicide occurrence by providing the victim with the required professional support, especially when the victim does not recognize the danger of having suicidal ideations. As technology usage has increased, people share and express their ideations digitally via social media, chatbots, and other digital platforms. In this paper, we proposed a novel, simple deep learning-based model to detect suicidal ideations in digital content, mainly focusing on chatbots as the primary data source. In addition, we provide a framework that employs the proposed suicide detection integration with a chatbot-based support system.","['Index', 'Terms: ', 'Suicide, deep learning, chatbot, natural language processing, detection']","['elsayeny@ucmail.uc.edu', 'elsayezs@ucmail.uc.edu', 'ozermm@ucmail.uc.edu']"
"The correctness of a compiler affects the correctness of every program written in the language, and thus must be thoroughly evaluated. Existing automatic compiler testing methods however either rely on weak oracles (e.g., a program behaves the same if only dead code is modified), or require substantial initial effort (e.g., having a complete operational language semantics).
While the former prevents a comprehensive correctness evaluation, the latter makes those methods irrelevant in practice.
In this work, we propose an axiomatic semantics based approach for testing compilers, called PTE. The idea is to incrementally develop a set of “axioms” capturing anecdotes of the language semantics in the form of (precondition, transformation, expectation) triples, which allows us to test the compiler automatically. Such axioms are written in the same language whose compiler is under test, and can be developed either based on the language specification, or by generalizing the bug reports. PTE has been applied to a newly developed compiler (i.e., Cangjie) and a mature compiler (i.e., Java), and successfully identified 42 implementation bugs and 9 potential language design issues.","['Compiler testing, language semantics, automated testing']","['UniversitySingaporeSingapore', 'UniversitySingaporeSingapore', 'UniversitySingaporeSingapore', 'UniversityBeijingChina', 'UniversityShanghaiChina']"
"The full array of the Large High Altitude Air Shower Observatory (LHAASO) has been in operation since July 2021. For its kilometer-square array (KM2A), we have optimized the selection criteria for very high and ultra-high energy γ𝛾\gammaitalic_γ-rays, using the data collected from August 2021 to August 2022, resulting in an improvement on significance of about 15%percent\%% compared with previous cuts. With the implementation of these new selection criteria, the angular resolution is also significantly improved by approximately 10%percent\%% at tens of TeV. Other aspects of the full KM2A array performance, such as the pointing error are also calibrated using the Crab Nebula. The resulting energy spectrum of the Crab Nebula in the energy range of 10-1000 TeV can be well fitted by a log-parabola model, which is consistent with the previous results from LHAASO and other experiments.","['γ𝛾\\gammaitalic_γ-ray;', 'Crab', 'Nebula; significance.']","['China', 'China', 'China', 'Ireland', 'Germany', 'China', 'China', 'China', 'China', 'China', 'China', 'China', 'China', 'China', 'China', 'China', 'China', 'China', 'China', 'China', 'China', 'China', 'China', 'China', 'China', 'China', 'China', 'China', 'China', 'China', 'China', 'China', 'China', 'China', 'China', 'China', 'China', 'China', 'China', 'China', 'China', 'China', 'China', 'China', 'China', 'China', 'China', 'China', 'China', 'China', 'China', 'China', 'China', 'China', 'China', 'China', 'China', 'China', 'China', 'China', 'Switzerland', 'China', 'China', 'China', 'China', 'China', 'China', 'China', 'China', 'China', 'China', 'China', 'China', 'China', 'China', 'China', 'France', 'China', 'China', 'China', 'China', 'China', 'China', 'China', 'China', 'China', 'China', 'China', 'China', 'China', 'China', 'China', 'China', 'China', 'China', 'China', 'China', 'China', 'China', 'China', 'China', 'China', 'China', 'China', 'China', 'China', 'China', 'China', 'China', 'China', 'China', 'China', 'Switzerland', 'China', 'China', 'China', 'China', 'China', 'China', 'China', 'China', 'China', 'China', 'China', 'China', 'China', 'China', 'China', 'China', 'China', 'China', 'China', 'China', 'China', 'China', 'China', 'China', 'China', 'China', 'China', 'China', 'China', 'China', 'China', 'China', 'China', 'China', 'China', 'China', 'China', 'China', 'China', 'Russia', 'Russia', 'Russia', 'China', 'China', 'China', 'China', 'China', 'China', 'China', 'China', 'China', 'China', 'China', 'China', 'China', 'China', 'China', 'China', 'China', 'China', 'China', 'China', 'China', 'China', 'China', 'China', 'China', 'China', 'China', 'China', 'China', 'China', 'China', 'China', 'China', 'China', 'China', 'China', 'China', 'China', 'China', 'China', 'China', 'China', 'China', 'China', 'China', 'China', 'China', 'China', 'China', 'China', 'China', 'China', 'China', 'China', 'China', 'China', 'China', 'China', 'China', 'China', 'China', 'China', 'China', 'China', 'China', 'China', 'China', 'China', 'China', 'China', 'China', 'Thailand', 'China', 'China', 'China', 'France', 'China', 'China', 'Thailand', 'China', 'China', 'China', 'China', 'China', 'China', 'China', 'Thailand', 'Thailand', 'France', 'China', 'China', 'Russia', 'Russia', 'China', 'China', 'China', 'China', 'Russia', 'Russia', 'Russia', 'China', 'China', 'China', 'China', 'China', 'China', 'China', 'China', 'China', 'China', 'China', 'China', 'China', 'China', 'China', 'China', 'China', 'China', 'China', 'China', 'China', 'China', 'China', 'China', 'China', 'China', 'China', 'China', 'China', 'China', 'China', 'China', 'China', 'China', 'China', 'China', 'China', 'China', 'China', 'China', 'China', 'China', 'China', 'China', 'China', 'China', 'China', 'China', 'China', 'China', 'China', 'China', 'China', 'China', 'China', 'China', 'China', 'China', 'China', 'China', 'China', 'China', 'China', 'China', 'China', 'China', 'China', 'China', 'China', 'China', 'China', 'China', 'China', 'China', 'China', 'China', 'China', 'China', 'China', 'China', 'China', 'China', 'China', 'China', 'China', 'China', 'China', 'China', 'China', 'China', 'China', 'China', 'China', 'China', 'China', 'China', 'China', 'China', 'China', 'China', 'China', 'China', 'China', 'China', 'China', 'China', 'China', 'China', 'China', 'China', 'China', 'China', 'China', 'China', 'China', 'China', 'China', 'China', 'China', 'China', 'China', 'China', 'China', 'China', 'China', 'China', 'China', 'China', 'China', 'China', 'China', 'China', 'China', 'China', 'China', 'China', 'China', 'China', 'China', 'China', 'China', 'China', 'China', 'China', 'China', 'China', 'China', 'China', 'China', 'China', 'China', 'China', 'China', 'China', 'China', 'China', 'China', 'China', 'China', 'China', 'China', 'China', 'China', 'China', 'China', 'China']"
"The recent development on large language models makes automatically constructing small programs possible. It thus has the potential to free software engineers from low-level coding and allow us to focus on the perhaps more interesting parts of software development, such as requirement engineering and system testing. In this project, we develop a prototype named AISD (AI-aided Software Development), which is capable of taking high-level (potentially vague) user requirements as inputs, generates detailed use cases, prototype system designs, and subsequently system implementation. Different from existing attempts, AISD is designed to keep the user in the loop, i.e., by repeatedly taking user feedback on use cases, high-level system designs, and prototype implementations through system testing. AISD has been evaluated with a novel benchmark of non-trivial software projects. The experimental results suggest that it might be possible to imagine a future where software engineering is reduced to requirement engineering and system testing only.","['Requirement engineering, system testing, large language model, code generation']","['UniversityShanghaiChina', 'UniversityShanghaiChina', 'UniversitySingaporeSingapore', 'UniversitySingaporeSingapore', 'UniversityShanghaiChina', 'UniversityShanghaiChina']"
"Studying the relations between entanglement and coherence is essential in many quantum information applications. For this, we consider the concurrence, intrinsic concurrence and first-order coherence, and evaluate the proposed trade-off relations between them. In particular, we study the temporal evolution of a general two-qubit XYZ Heisenberg model with asymmetric spin-orbit interaction under decoherence and analyze the trade-off relations of quantum resource theory.
For XYZ Heisenberg model, we confirm that the trade-off relation between intrinsic concurrence and first-order coherence holds. Furthermore, we show that the lower bound of intrinsic concurrence is universally valid, but the upper bound is generally not.
These relations in Heisenberg models can provide a way to explore how quantum resources are distributed in spins, which may inspire future applications in quantum information processing.","['Trade-off relations,', 'First-order coherence,', 'Intrinsic concurrence,', 'Heisenberg models']","['Qatar', 'Qatar', 'Iran']"
"In this paper, we present Coyote C++, a fully automated white-box unit testing tool for C and C++. Whereas existing tools have struggled to realize unit test generation for C++, Coyote C++ is able to produce high coverage results from unit test generation at a testing speed of over 10,000 statements per hour. This impressive feat is made possible by the combination of a powerful concolic execution engine with sophisticated automated test harness generation. Additionally, the GUI of Coyote C++ displays detailed code coverage visualizations and provides various configuration features for users seeking to manually optimize their coverage results. Combining potent one-click automated testing with rich support for manual tweaking, Coyote C++ is the first automated testing tool that is practical enough to make automated testing of C++ code truly viable in industrial applications.","['Index', 'Terms: ', 'Software', 'Testing,', 'Test case generation,', 'Automated unit test generation,', 'Symbolic execution,', 'C++']","['rho@codemind.co.kr', 'yeoneo@codemind.co.kr', 'philipp.m@codemind.co.kr', 'shin@codemind.co.kr']"
"Poetry generation has been a challenging task in the field of Natural Language Processing, as it requires the model to understand the nuances of language, sentiment, and style. In this paper, we propose using Large Language Models to generate Vietnamese poems from natural language prompts, thereby facilitating an intuitive process with enhanced content control. Our most efficacious model, the GPT-3 Babbage variant, achieves a custom evaluation score of 0.8, specifically tailored to the ”luc bat” genre of Vietnamese poetry. Furthermore, we also explore the idea of paraphrasing poems into normal text prompts and yield a relatively high score of 0.718 in the ”luc bat” genre. This experiment presents the potential for cross-Language poem-to-poem translation with translated poems as the inputs while concurrently maintaining complete control over the generated content.","['GPT-3, poem generation,', 'BLOOM,', 'Vietnamese, quantization,', 'LoRa']","['CityVietnam', 'CityVietnam']"
"Aircraft landing time (ALT) prediction is crucial for air traffic management, especially for arrival aircraft sequencing on the runway. In this study, a trajectory image-based deep learning method is proposed to predict ALTs for the aircraft entering the research airspace that covers the Terminal Maneuvering Area (TMA). Specifically, the trajectories of all airborne arrival aircraft within the temporal capture window are used to generate an image with the target aircraft trajectory labeled as red and all background aircraft trajectory labeled as blue. The trajectory images contain various information, including the aircraft position, speed, heading, relative distances, and arrival traffic flows. It enables us to use state-of-the-art deep convolution neural networks for ALT modeling. We also use real-time runway usage obtained from the trajectory data and the external information such as aircraft types and weather conditions as additional inputs. Moreover, a convolution neural network (CNN) based module is designed for automatic holding-related featurizing, which takes the trajectory images, the leading aircraft holding status, and their time and speed gap at the research airspace boundary as its inputs. Its output is further fed into the final end-to-end ALT prediction. The proposed ALT prediction approach is applied to Singapore Changi Airport (ICAO Code: WSSS) using one-month Automatic Dependent Surveillance-Broadcast (ADS-B) data from November 1 to November 30, 2022. Experimental results show that by integrating the holding featurization, we can reduce the mean absolute error (MAE) from 82.23 seconds to 43.96 seconds, and achieve an average accuracy of 96.1%, with 79.4% of the predictions errors being less than 60 seconds.","['Air', 'Traffic', 'Management,', 'Aircraft', 'Landing', 'Time,', 'Trajectory', 'Image,', 'Convolution', 'Neural', 'Networks.']",['Singapore']
"The Gaia DR3 parallax approach was used to estimate the absolute parameters of 2375 δ𝛿\deltaitalic_δ Scuti stars from the ASAS catalog. The selected stars have a variety of observational characteristics, with a higher than 80% probability of being δ𝛿\deltaitalic_δ Scuti stars. We have displayed all the stars in the Hertzsprung-Russell (H-R) diagram along with the δ𝛿\deltaitalic_δ Scuti instability strip, the Zero Age Main Sequence (ZAMS), and the Terminal-Age Main Sequence (TAMS). Then, we determined which fundamental and overtone modes each star belongs to using pulsation constant (Q𝑄Qitalic_Q) calculations. In addition, we evaluated the parameters in the Q𝑄Qitalic_Q calculation equation using three machine learning methods, which showed that surface gravity and temperature have the greatest effect on its calculation. The Period-Luminosity (P−L𝑃𝐿P-Litalic_P - italic_L) relationship of the δ𝛿\deltaitalic_δ Scuti stars was also revisited. Eventually, using least squares linear regression, we made four linear fits for fundamental and overtone modes and updated their relationships.","['δ𝛿\\deltaitalic_δ', 'Scuti variable stars -', 'Fundamental parameters -', 'Data analysis']","['poroatila@gmail.com', 'Canada', 'USA', 'Iran', 'Iran', 'Italy', 'Iran', 'Iran', 'Iran', 'Iran', 'Iran']"
"Joint Communication and Sensing (JCAS) is taking its first shape in WLAN sensing under IEEE 802.11bf, where standardized WLAN signals and protocols are exploited to enable radar-like sensing. However, an overlooked problem in JCAS, and specifically in WLAN Sensing, is the sensitivity of the system to a deceptive jammer, which introduces phantom targets to mislead the victim radar receiver. Standardized waveforms and sensing parameters make the system vulnerable to physical layer attacks. Moreover, orthogonal frequency-division multiplexing (OFDM) makes deceptive jamming even easier as it allows digitally generated artificial range/Doppler maps. This paper studies deceptive jamming in JCAS, with a special focus on WLAN Sensing. The provided mathematical models give insights into how to design jamming signals and their impact on the sensing system. Numerical analyses illustrate various distortions caused by deceptive jamming, while the experimental results validate the need for meticulous JCAS design to protect the system against physical layer attacks in the form of deceptive jamming.","['Index', 'Terms: ', 'Joint', 'Communication and', 'Sensing,', 'WLAN', 'Sensing, deceptive jamming, physical layer security,', 'OFDM radars.']","['Belgium', 'Sweden']"
"Rust relies on its unique ownership mechanism to ensure thread and memory safety. However, numerous potential security vulnerabilities persist in practical applications. New language features in Rust pose new challenges for vulnerability detection. This paper proposes a static deadlock detection method tailored for Rust programs, aiming to identify various deadlock types, including double lock, conflict lock, and deadlock associated with conditional variables. With due consideration for Rust’s ownership and lifetimes, we first complete the pointer analysis. Then, based on the obtained points-to information, we analyze dependencies among variables to identify potential deadlocks. We develop a tool and conduct experiments based on the proposed method. The experimental results demonstrate that our method outperforms existing deadlock detection methods in precision.","['Rust', 'Programs,', 'Static', 'Analysis,', 'Deadlock', 'Detection']","['UniversityShanghaiChina', 'UniversityShanghaiChina', 'UniversityShanghaiChina']"
"Tree-based models have been successfully applied to a wide variety of tasks, including time series forecasting.
They are increasingly in demand and widely accepted because of their comparatively high level of interpretability. However, many of them suffer from the overfitting problem, which limits their application in real-world decision-making. This problem becomes even more severe in online-forecasting settings where time series observations are incrementally acquired, and the
distributions from which they are drawn may keep changing over time. In this context, we propose a novel method for the online selection of tree-based models using the TreeSHAP explainability method in the task of time series forecasting. We start with an arbitrary set of different tree-based models. Then, we outline a performance-based ranking with a coherent design to make TreeSHAP able to specialize the tree-based forecasters across different regions in the input time series. In this framework, adequate model selection is performed online, adaptively following drift detection in the time series. In addition, explainability is supported on three levels, namely online input importance, model selection, and model output explanation. An extensive empirical study on various real-world datasets demonstrates that our method achieves excellent or on-par results in comparison to the state-of-the-art approaches as well as several baselines.","['Index', 'Terms: ', 'Online', 'Model', 'Selection,', 'Tree-based', 'Models,', 'Time', 'Series', 'Forecasting,', 'TreeSHAP,', 'Explainability']","['matthias.jakobs@tu-dortmund.de', 'amal.saadallah@cs.tu-dortmund.de']"
