abstract,keyword,country
"Using large training datasets enhances the generalization capabilities of neural networks.
Semi-supervised learning (SSL) is useful when there are few labeled data and a lot of unlabeled data.
SSL methods that use data augmentation are most successful for image datasets.
In contrast, texts do not have consistent augmentation methods as images.
Consequently, methods that use augmentation are not as effective in text data as they are in image data.
In this study, we compared SSL algorithms that do not require augmentation; these are self-training, co-training, tri-training, and tri-training with disagreement.
In the experiments, we used 4 different text datasets for different tasks.
We examined the algorithms from a variety of perspectives by asking experiment questions and suggested several improvements.
Among the algorithms, tri-training with disagreement showed the closest performance to the Oracle; however, performance gap shows that new semi-supervised algorithms or improvements in existing methods are needed.","['Index', 'Terms: \nsemi supervised learning, self-training, co-training, tri-training, tri-training with disagreement']","['tkesgin@yildiz.edu.tr', 'amasyali@yildiz.edu.tr']"
"We use the VERITAS imaging air Cherenkov Telescope (IACT) array to obtain the first measured angular diameter of β𝛽\betaitalic_β UMa at visual wavelengths using stellar intensity interferometry (SII) and independently constrain the limb-darkened angular diameter.
The age of the Ursa Major moving group has been assessed from the ages of its members, including nuclear member Merak (β𝛽\betaitalic_β UMa), an A1-type subgiant, by comparing effective temperature and luminosity constraints to model stellar evolution tracks.
Previous interferometric limb-darkened angular-diameter measurements of β𝛽\betaitalic_β UMa in the near-infrared (CHARA Array, 1.149 ±plus-or-minus\pm± 0.014 mas) and mid-infrared (Keck Nuller, 1.08 ±plus-or-minus\pm± 0.07 mas), together with the measured parallax and bolometric flux, have constrained the effective temperature.
This paper presents current VERITAS-SII observation and analysis procedures to derive squared visibilities from correlation functions.
We fit the resulting squared visibilities to find a limb-darkened angular diameter of 1.07±0.04⁢(stat)±0.05plus-or-minus1.070.04stat0.051.07\pm 0.04{\rm~{}(stat)}\pm 0.051.07 ± 0.04 ( roman_stat ) ± 0.05 (sys) mas, using synthetic visibilities from a stellar atmosphere model that provides a good match to the spectrum of β𝛽\betaitalic_β UMa in the optical wave band. The VERITAS-SII limb-darkened angular diameter yields an effective temperature of 9700±200±200plus-or-minus97002002009700\pm 200\pm 2009700 ± 200 ± 200 K,
consistent with ultraviolet spectrophotometry, and an age of 390±29±32plus-or-minus3902932390\pm 29\pm 32390 ± 29 ± 32 Myr, using MESA Isochrones and Stellar Tracks (MIST). This age is consistent with 408 ±plus-or-minus\pm± 6 Myr from the CHARA Array angular diameter.","['Long baseline interferometry (932),', 'Fundamental parameters of stars (555),', 'Astronomy data modeling (1859)']","['USA', 'USA', 'USA', 'USA', 'Germany', 'USA', 'USA', 'USA', 'USA', 'USA', 'USA', 'USA', 'USA', 'USA', 'USA', 'USA', 'USA', 'USA', 'Germany', 'USA', 'USA', 'USA', 'Canada', 'France', 'USA', 'Ireland', 'USA', 'Ireland', 'USA', '3N6', 'USA', 'Germany', 'Germany', 'Ireland', 'USA', 'Canada', 'USA', 'USA', 'USA', 'Germany', 'USA', 'USA', 'USA', 'Germany', 'USA', 'USA', 'Canada']"
"Context: Cybercrime groups, driven by financial and geopolitical motives, launch advanced persistent threat (APT) attacks. The attacks consist of adversarial techniques, which adversaries perform step-by-step by during cyberattacks. Cybersecurity vendors often publish cyber threat intelligence (CTI) reports, referring to the written artifacts on technical and forensic analysis of the techniques used by the malware in APT attacks. To defend organizations, prevalent techniques used by malware in APT attacks and the association among the techniques need to be identified. Objective: The goal of this research is to inform cybersecurity practitioners about how adversaries form cyberattacks through an analysis of adversarial techniques documented in cyberthreat intelligence reports. Dataset: We use 594 adversarial techniques cataloged in MITRE ATT&CK. We systematically construct a set of 667 CTI reports that MITRE ATT&CK used as citations in the descriptions of the cataloged adversarial techniques. Methodology: We analyze the frequency and trend of adversarial techniques, followed by a qualitative analysis of the implementation of techniques. Next, we perform association rule mining to identify pairs of techniques recurring in APT attacks. We then perform qualitative analysis to identify the underlying relations among the techniques in the recurring pairs. Findings: The set of 667 CTI reports documents 10,370 techniques in total, and we identify 19 prevalent techniques accounting for 37.3% of documented techniques. We also identify 425 statistically significant recurring pairs and seven types of relations among the techniques in these pairs. The top three among the seven relationships suggest that techniques used by the malware inter-relate with one another in terms of (a) abusing or affecting the same system assets, (b) executing in sequences, and (c) overlapping in their implementations. We identify that obtaining information on the operating and network system of the victim environment is the most prevalent technique and appears in the highest number of recurring pairs. We identify that spear-phishing is the most prevalent way of initial infection. We also identify three prevalent misuses of system functionalities: macro in office documents, registry in Windows, and task scheduler. We also identify that mimicking legitimate users through compromised credentials is the most prevalent persistence-related technique used by malware. Overall, the study quantifies how adversaries leverage techniques through malware in APT attacks based on publicly reported documents. We advocate organizations prioritize their defense against the identified prevalent techniques and actively hunt for potential malicious intrusion based on the identified pairs of techniques.","['Tactics, techniques, and procedures,', 'ATT&CK,', 'APT attacks,', 'Multi-stage attacks, malware, cyber-criminal groups, cyber-threat actors,', 'TTPs,', 'Advanced persistent threats,', 'Threat hunting,', 'Cyberattack']","['UniversityRaleighNCUSA', 'UniversityRaleighNCUSA', 'UniversityRaleighNCUSA', 'UniversityRaleighNCUSA']"
"On 2022 February 15, an impressive filament eruption was observed off the solar eastern limb from three remote-sensing viewpoints, namely Earth, STEREO-A, and Solar Orbiter. In addition to representing the most-distant observed filament at extreme ultraviolet wavelengths—captured by Solar Orbiter’s field of view extending to above 6 R⊙subscript𝑅direct-productR_{\odot}italic_R start_POSTSUBSCRIPT ⊙ end_POSTSUBSCRIPT—this event was also associated with the release of a fast (∼similar-to\sim∼2200 km⋅⋅\cdot⋅s−11{}^{-1}start_FLOATSUPERSCRIPT - 1 end_FLOATSUPERSCRIPT) coronal mass ejection (CME) that was directed towards BepiColombo and Parker Solar Probe. These two probes were separated by 2∘{}^{\circ}start_FLOATSUPERSCRIPT ∘ end_FLOATSUPERSCRIPT in latitude, 4∘{}^{\circ}start_FLOATSUPERSCRIPT ∘ end_FLOATSUPERSCRIPT in longitude, and 0.03 au in radial distance around the time of the CME-driven shock arrival in situ. The relative proximity of the two probes to each other and to the Sun (∼similar-to\sim∼0.35 au) allows us to study the mesoscale structure of CMEs at Mercury’s orbit for the first time. We analyse similarities and differences in the main CME-related structures measured at the two locations, namely the interplanetary shock, the sheath region, and the magnetic ejecta. We find that, despite the separation between the two spacecraft being well within the typical uncertainties associated with determination of CME geometric parameters from remote-sensing observations, the two sets of in-situ measurements display some profound differences that make understanding of the overall 3D CME structure particularly challenging. Finally, we discuss our findings within the context of space weather at Mercury’s distances and in terms of the need to investigate solar transients via spacecraft constellations with small separations, which has been gaining significant attention during recent years.","['Solar filament eruptions (1981);', 'Solar coronal mass ejections (310);', 'Interplanetary magnetic fields (824);', 'Interplanetary shocks (829)']","['USA', 'USA', 'USA', 'USA', 'USA', 'UK', 'USA', 'USA', 'USA', 'USA', 'USA', 'USA', 'USA', 'Germany', 'Germany', 'USA', 'USA', 'USA', 'Belgium', 'Russia', 'Belgium', 'USA', 'USA', 'Spain', 'Spain', 'USA', 'Finland', 'Finland', 'Finland', 'Austria', 'Austria', 'Germany', 'Germany', 'USA', 'USA', 'Belgium', 'Romania']"
"Relativistic jets accompany the collapse of massive stars, the merger of compact objects, or the accretion of gas in active galactic nuclei. They carry information about the central engine and generate electromagnetic radiation. No self-consistent simulations have been able to follow these jets from their birth at the black hole scale to the Newtonian dissipation phase, making the inference of central engine property through astronomical observations undetermined. We present the general relativistic moving-mesh framework to achieve the continuity of jet simulations throughout space-time. We implement the general relativistic extension for the moving-mesh relativistic hydrodynamic code-JET, and develop a tetrad formulation to utilize the HLLC Riemann solver in the general relativistic moving mesh code. The new framework is able to trace the radial movement of the relativistic jets from the central region where strong gravity holds all the way to distances of jet dissipation.","['General', 'Relativistic,', 'Relativistic jet,', 'HLLC']","['Germany', 'Germany']"
"As time progresses, the need for more secure applications grows exponentially. The different types of sensitive information that is being transferred virtually has sparked a rise in systems that leverage blockchain. Different sectors are beginning to use this disruptive technology to evaluate the risks and benefits. Sectors like finance, medicine, higher education, and wireless communication have research regarding blockchain. Futhermore, the need for security standards in this area of research is pivotal. In recent past, several attacks on blockchain infrastructures have resulted in hundreds of millions dollars lost and sensitive information compromised. Some of these attacks include DAO attacks, bZx attacks, and Parity Multisignature Wallet Double Attacks which targeted vulnerabilities within smart contracts on the Ethereum network. These attacks exposed the weaknesses of current smart contract development practices which has led to the increase in distrust and adoption of systems that leverage blockchain for its functionality. In this paper, I identify common software vulnerabilities and attacks on blockchain infrastructures, thoroughly detail the smart contract development process and propose a model for ensuring a stronger security standard for future systems leveraging smart contracts. The purpose for proposing a model is to promote trust among end users in the system which is a foundational element for blockchain adoption in the future.","['Index', 'Terms: ', 'Smart', 'Contract,', 'Blockchain,', 'Software', 'Development,', 'Cybersecurity']",['crawford@cs.ua.edu']
"In recent years, foundation models (FMs) have solidified their role as cornerstone advancements in the deep learning domain. By extracting intricate patterns from vast datasets, these models consistently achieve state-of-the-art results across a spectrum of downstream tasks, all without necessitating extensive computational resources [1].
Notably, MedCLIP [2], a vision-language contrastive learning-based medical FM, has been designed using unpaired image-text training. While the medical domain has often adopted unpaired training to amplify data [3], the exploration of potential security concerns linked to this approach hasn’t kept pace with its practical usage. Notably, the augmentation capabilities inherent in unpaired training also indicate that minor label discrepancies can result in significant model deviations. In this study, we frame this label discrepancy as a backdoor attack problem. We further analyze its impact on medical FMs throughout the FM supply chain. Our evaluation primarily revolves around MedCLIP, emblematic of medical FM employing the unpaired strategy. We begin with an exploration of vulnerabilities in MedCLIP stemming from unpaired image-text matching, termed BadMatch. BadMatch is achieved using a modest set of wrongly labeled data. Subsequently, we disrupt MedCLIP’s contrastive learning through BadDist-assisted BadMatch by introducing a Bad-Distance between the embeddings of clean and poisoned data. Intriguingly, when BadMatch and BadDist are combined, a slight 0.05 percent of misaligned image-text data can yield a staggering 99 percent attack success rate, all the while maintaining MedCLIP’s efficacy on untainted data. Additionally, combined with BadMatch and BadDist, the attacking pipeline consistently fends off backdoor assaults across diverse model designs, datasets, and triggers. Also, our findings reveal that current defense strategies are insufficient in detecting these latent threats in medical FMs’ supply chains. Code and pre-trained models can be found at https://github.com/ubc-tea/Backdoor_Multimodal_Foundation_Model.","['Index', 'Terms: ', 'Backdoor', 'Attack,', 'Foundation', 'Models,', 'Vision-Text', 'Models.', 'Contrastive', 'Learning']","['Columbia', 'Institute', 'University']"
"“Changing-look” Active Galactic Nuclei (CL-AGNs) are challenging our basic ideas about the physics of accretion flows and of circumnuclear gas around supermassive black holes (SMBHs).
Using first-year Sloan Digital Sky Survey V (SDSS-V) repeated spectroscopy of nearly 29,000 previously-known AGNs, combined with dedicated follow-up spectroscopic observations, and publicly available optical light curves, we have identified 116 CL-AGNs where (at least) one broad emission line has essentially (dis-)appeared, as well as 88 other extremely variable systems.
Our CL-AGN sample, with 107 newly identified cases, is among the largest reported to date, and includes ∼0.4%similar-toabsentpercent0.4\sim 0.4\%∼ 0.4 % of the AGNs re-observed in the first year of SDSS-V operations.
Among our CL-AGNs, 67% exhibit dimming while 33% exhibit brightening.
Our data and sample probe extreme AGN spectral variability on timescales of months to decades, including some cases of recurring transitions on surprisingly short timescales (≲2less-than-or-similar-toabsent2\lesssim 2≲ 2 months in the rest frame).
We find that CL events are preferentially found in lower Eddington ratio (fEddsubscript𝑓Eddf_{\mathrm{Edd}}italic_f start_POSTSUBSCRIPT roman_Edd end_POSTSUBSCRIPT) systems: Our CL-AGNs have a fEddsubscript𝑓Eddf_{\mathrm{Edd}}italic_f start_POSTSUBSCRIPT roman_Edd end_POSTSUBSCRIPT distribution that significantly differs from that of a redshift- and a carefully constructed, luminosity-matched control sample (pKS≲2×10−4less-than-or-similar-tosubscript𝑝KS2superscript104p_{\rm KS}\lesssim 2\times 10^{-4}italic_p start_POSTSUBSCRIPT roman_KS end_POSTSUBSCRIPT ≲ 2 × 10 start_POSTSUPERSCRIPT - 4 end_POSTSUPERSCRIPT; median fEdd≈0.025subscript𝑓Edd0.025f_{\mathrm{Edd}}\approx 0.025italic_f start_POSTSUBSCRIPT roman_Edd end_POSTSUBSCRIPT ≈ 0.025 vs. 0.0430.0430.0430.043).
This preference for low fEddsubscript𝑓Eddf_{\mathrm{Edd}}italic_f start_POSTSUBSCRIPT roman_Edd end_POSTSUBSCRIPT strengthens previous findings of higher CL-AGN incidence at lower Eddington ratios, found in much smaller samples of spectroscopically confirmed CL-AGNs.
Finally, we show that the broad Mg ii emission line in our CL-AGN sample tends to vary significantly less than the broad Hβ𝛽\betaitalic_β emission line.
Our large CL-AGN sample demonstrates the advantages and challenges in using multi-epoch spectroscopy from large surveys to study extreme AGN variability, SMBH fueling, and AGN physics.","['Supermassive black holes (1663),', 'Quasars (1319),', 'Active galactic nuclei (16)']","['Israel', 'Israel', 'USA', 'USA', 'USA', 'USA', 'USA', 'USA', 'Chile', 'Chile', 'Chile', 'USA', 'USA', 'USA', 'USA', 'USA', 'USA', 'USA', 'USA', 'USA', 'Chile', 'USA', 'Germany', 'USA', 'USA', 'USA', 'Chile', 'Chile', 'China', 'USA', 'USA', 'USA', 'USA', 'Israel', 'Chile', 'USA', 'China', 'USA', 'Germany', 'USA', 'USA', 'Moscow', 'USA', 'USA', 'Canada']"
"We present a methodology for modeling and removing light from cluster galaxies and intracluster light (ICL) from James Webb Space Telescope (JWST ) images of gravitational lensing clusters. We apply our method to Webb’s First Deep Field the SMACS 0723 Early Release Observations and use the ICL subtracted images to select a sample of globular clusters (GCs) and dwarf galaxies within the cluster. We compare the spatial distributions of these two samples with our models of the galaxy and ICL light, finding significant similarity. Specifically we find that GCs trace the diffuse ICL, while dwarf galaxies are centrally concentrated near the cluster center We quantify the relationship between the surface density of compact sources and total cluster light, demonstrating a significant, tight correlation. We repeat our methodology and compare distributions of GCs with dark matter surface density and find a comparable result. Our findings suggest a common origin for GCs and diffuse ICL, with stripping from massive galaxies as they merge with the cluster being a plausible scenario.",['JWST\xa0; galaxies'],"['Canada', 'Canada', 'Slovenia', 'Canada', 'Canada', 'Canada', 'Canada', 'Japan', 'Slovenia', 'USA', 'Denmark', 'Denmark', 'Slovenia', 'Canada', 'Canada', 'Canada', 'Denmark', 'Slovenia']"
"The increased demand of cyber security professionals has also increased the development of new platforms and tools that help those professionals to improve their offensive skills. One of these platforms is HackTheBox, an online cyber security training platform that delivers a controlled and safe environment for those professionals to explore virtual machines in a Capture the Flag (CTF) competition style.
Most of the tools used in a CTF, or even on real-world Penetration Testing (Pentest), were developed for specific reasons so each tool usually has different input and output formats. These different formats make it hard for cyber security professionals and CTF competitors to develop an attack graph. In order to help cyber security professionals and CTF competitors to discover, select and exploit an attack vector, this paper presents Shadow Blade, a tool to aid users to interact with their attack vectors.","['Index', 'Terms: \n\ncapture the flag, cyber security,', 'HackTheBox, attack graph']",['avelino.zorzo@pucrs.br3']
"In the ever-changing and dynamic realm of high-end fashion marketplaces, providing accurate and personalized size recommendations has become a critical aspect. Meeting customer expectations in this regard is not only crucial for ensuring their satisfaction but also plays a pivotal role in driving customer retention, which is a key metric for the success of any fashion retailer. 
We propose a novel sequence classification approach to address this problem, integrating implicit (Add2Bag) and explicit (ReturnReason) user signals.
Our approach comprises two distinct models: one employs LSTMs to encode the user signals, while the other leverages an Attention mechanism.
Our best model outperforms SFNet, improving accuracy by 45.7%.
By using Add2Bag interactions we increase the user coverage by 24.5% when compared with only using Orders.
Moreover, we evaluate the models’ usability in real-time recommendation scenarios by conducting experiments to measure their latency performance.","['Size', 'Recommendation,', 'Recommendations', 'Systems,', 'Size and', 'Fit,', 'Personalization,', 'E-commerce']","['FARFETCHLisbonPortugal', 'FARFETCHPortoPortugal', 'FARFETCHPortoPortugal', 'Kingdom']"
"We present the detection of a magnetized dust ring (M0.8-0.2) in the Central Molecular Zone (CMZ) of the Galactic Center. The results presented in this paper utilize the first data release (DR1) of the Far-Infrared Polarimetric Large Area CMZ Exploration (FIREPLACE) survey (i.e., FIREPLACE I; Butterfield et al., 2023). The FIREPLACE survey is a 214 µm polarimetic survey of the Galactic Center using the SOFIA/HAWC+ telescope. The M0.8–0.2 ring is a region of gas and dust that has a circular morphology with a central depression. The dust polarization in the M0.8–0.2 ring implies a curved magnetic field that traces the ring-like structure of the cloud. We posit an interpretation in which an expanding shell compresses and concentrates the ambient gas and magnetic field. We argue that this compression results in the strengthening of the magnetic field, as we infer from the observations toward the interior of the ring.","['Galactic', 'Center,', 'Interstellar', 'Medium,', 'Dust', 'Continuum', 'Emission,', 'Polarimetry']","['USA', 'USA', 'USA', 'USA', 'USA', 'USA', 'USA', 'USA', 'USA', 'USA', 'USA']"
"We present our sixth set of results from our mid-infrared imaging survey of Milky Way Giant H ii regions with our detailed analysis of NGC 3603, the most luminous GH ii region in the Galaxy. We used imaging data from the FORCAST instrument on the Stratospheric Observatory For Infrared Astronomy (SOFIA) at 20 and 37 μ𝜇\muitalic_μm which mapped the central ∼similar-to\sim∼8.5′×8.5⁢′′8.5′\arcmin\times 8.5\arcmin′ × 8.5 ′ infrared-emitting area of NGC 3603 at a spatial resolution of ≲less-than-or-similar-to\lesssim≲3″″\arcsec″. Utilizing these SOFIA data in conjunction with multi-wavelength observations from the near-infrared to radio, including Spitzer-IRAC and Herschel-PACS archival data, we investigate the physical nature of individual infrared sources and sub-components within NGC 3603. For individual compact sources we used the multi-wavelength photometry data to construct spectral energy distributions (SEDs) and fit them with massive young stellar object (MYSO) SED models, and find 14 sources that are likely to be MYSOs. We also detect dust emission from the 3 massive proplyd candidates, as well as from the disk and outflow of the evolved blue supergiant, Sher 25. Utilizing multi-wavelength data, we derived luminosity-to-mass ratio and virial parameters for the star-forming clumps within NGC 3603, estimating their relative ages and finding that NGC 3603 is an older GH ii region overall, compared to our previously studied GH ii regions. We discuss how NGC 3603, which we categorize as a ‘cavity-type’ GH ii region, exhibits a more modest number of MYSOs and molecular clumps when compared to the ‘distributed-type’ GH ii regions that share similar Lyman continuum photon rates.","['ISM:', 'H ii regions — infrared: stars —– stars: formation —– infrared:', 'ISM: continuum —–', 'ISM: individual(W49A)']","['USA', 'USA', 'USA', 'USA']"
"An inner component misaligned from an outer component in a protoplanetary disk can result in the former casting shadows on the latter.
We present a new instance of shadowing on the outer disk around a very low mass star, ZZ Tau IRS. Through the analysis of near-infrared (NIR) archival data at λ=1.6𝜆1.6\lambda=1.6italic_λ = 1.6 μ𝜇\muitalic_μm acquired with the Wide Field Camera 3 on the Hubble Space Telescope, we identified brightness asymmetries in the top and bottom halves of the highly inclined outer disk, separated by a dark lane. The brighter sides in the top and bottom halves are on the opposite sides, which we attributed to shadows cast by a misaligned inner disk. Radiative transfer modeling of the system with a misaligned angle of 15 deg between the inner and outer disks well reproduced the observations.
Additionally, we found an elevated brightness temperature of 1212{}^{12}start_FLOATSUPERSCRIPT 12 end_FLOATSUPERSCRIPTCO (3-2) at r∼30similar-to𝑟30r\sim 30italic_r ∼ 30 au on the brighter side in NIR wavelengths in the top half disk, which can be explained by the shadowing effect too.
While the origin of the misaligned inner disk remains unclear, future monitoring observations to search for temporal variations in brightness asymmetries will likely provide useful clues.","['Protoplanetary disks (1300);', 'Planetary-disk interactions (2204);', 'Exoplanet formation (492);', 'M stars (985);', 'Near infrared astronomy (1093);', 'Hubble', 'Space', 'Telescope (756); stars: individual (ZZ', 'Tau', 'IRS)']","['Japan', 'Japan', 'Japan', 'Canada', 'Japan', 'Netherlands', 'Japan', 'R.O.C.', 'R.O.C.', 'R.O.C', 'R.O.C.']"
